{
  "protocol": "baijin-phase5-audit-log/1.0",
  "audit_id": "phase5-audit-log-production-enabled-001",
  "phase": "phase5",
  "repository": "shunhang776/xinbaijin-mcp",
  "branch": "dev",
  "event_type": "production_enforcer_enabled",
  "actor": "owner",
  "action": "enabled Phase5 production enforcer after manual approval",
  "target": {
    "type": "phase5_enablement",
    "id": "phase5-enablement-production-001"
  },
  "manual_confirmation": true,
  "approvals": {
    "owner_approval": true,
    "gate_owner_approval": true,
    "rollback_owner_approval": true
  },
  "input_artifacts": [
    "artifacts/phase5/phase5-enablement.json",
    "artifacts/phase5/phase5-readiness.json",
    "artifacts/phase5/phase5-rollback-plan.json"
  ],
  "output_artifacts": [
    "artifacts/phase5/phase5-audit-log.json"
  ],
  "decision_snapshot": {
    "readiness_status": "production_ready",
    "ready_for_production": true,
    "blocker_count": 0
  },
  "integrity": {
    "artifacts_verified": true,
    "sha256_available": true,
    "utf8_valid": true,
    "line_ending_recorded": true
  },
  "created_at": "2026-06-27T00:00:00.000Z"
}
